{
  "turn": 1,
  "student_view": {
    "scene": "오전 9시 10분, 교사와 함께 허가된 숲길의 관찰 지점 A에 섰다. 비는 오지 않고 바람은 약하다. 길을 벗어나지 않은 채 8분 동안 눈으로 본 것, 귀로 들은 것, 동물이 남긴 듯한 흔적을 나누어 적는다. 생물이나 흔적에는 손대지 않으며, 이름이 확실하지 않으면 미확인으로 남긴다.",
    "clues": [
      "[확인됨] 발자국, 구멍, 갉은 잎, 긁힌 자국, 소리는 동물 활동을 살피는 단서가 될 수 있다.",
      "[확인됨] 비교하려면 장소, 날짜, 시작·종료 시각, 날씨, 관찰자를 함께 기록해야 한다.",
      "[수업 가정] 지점 A와 B에서 각각 8분 동안 같은 기록표를 사용한다.",
      "[아직 모름] 이번에 보이지 않은 동물이 실제로 이 숲에 없는지는 알 수 없다."
    ],
    "thinking_question": "A와 B의 기록을 나중에 공정하게 비교하려면 관찰을 시작하기 전에 무엇을 먼저 같게 정하거나 기록해야 할까?",
    "choices": [
      "시작 시각, 날씨, 관찰자, 8분 타이머를 먼저 기록한다.",
      "눈에 띄는 흔적의 모양과 위치를 이름 추측 없이 사진과 글로 남긴다.",
      "잘 모르겠는 단서는 교사에게 알리고 미확인으로 표시한다."
    ],
    "custom_input_allowed": true
  },
  "teacher_view": {
    "evidence_rationale": "VER-103과 VER-104로 관찰 대상과 표준화 항목을 제시하고, SCN-101의 8분은 수업용 조건으로 분리하며 실제 부재는 UNKNOWN으로 남긴다.",
    "misconception_watch": "학생이 흔적 수를 실제 개체 수로 바로 바꾸거나, 한 번 보지 못한 생물을 없다고 단정하거나, 확인을 위해 흔적을 만지려 하는지 본다.",
    "assessment_note": "학생이 시간·장소·날씨·관찰자 중 두 가지 이상을 비교 조건으로 제안하고 미확인 기록을 받아들이는지 관찰한다."
  },
  "evidence_ids": ["VER-102", "VER-103", "VER-104", "VER-105", "SCN-101", "UNK-102", "DER-101"],
  "memory_delta": {
    "base_revision": 0,
    "next_revision": 1,
    "add": [
      {
        "path": "/memory/episode_archive/-",
        "value": {
          "id": "EP-101",
          "turn": 1,
          "student_choice": "[시작] 토큰으로 비접촉 숲 생태 조사를 시작",
          "result": "지점 A에서 기록 조건을 먼저 정하는 첫 장면과 세 가지 안전한 선택지가 제시되었다.",
          "evidence_ids": ["VER-102", "VER-103", "VER-104", "SCN-101", "UNK-102"],
          "must_keep": true
        },
        "reason": "첫 관찰의 조건과 비접촉 제약을 시간 순서에 보존한다."
      }
    ],
    "correct": [],
    "resolve": []
  }
}
