{
  "turn": 1,
  "student_view": {
    "scene": "중학교 3학년 역사 자료 조사팀의 화면에 1950년 유엔 결의·미국 대통령 발표·소련 신문 논평과 1951년 전쟁기 소녀 사진이 놓여 있다. 학생은 전투를 재현하지 않고 자료의 작성 주체와 한계를 비교한다.",
    "clues": [
      "[확인된 사실] 유엔 안전보장이사회는 1950년 6월 25일 결의 제82호를 채택했다.",
      "[자료 속 주장] 트루먼 대통령은 1950년 6월 27일 '북한에서 온 침입군에게 공격받았다'고 발표하고 미국 공군·해군 지원을 명령했다. 인용은 진행자 번역이다.",
      "[자료 속 주장] 프라우다는 1950년 6월 28일 '남한군의 도발적 행동이 군사 작전을 일으켰다'고 반대로 주장했다. 인용은 진행자 번역이며 진위는 별도 검증 대상이다.",
      "[민간 경험의 단서] 미국 국립문서기록관리청의 1951년 사진은 동생을 업고 걷는 소녀를 보여 준다. 표제는 두 사람을 피란민이라고 밝히지 않으며 사진은 전체 피해 규모나 원인을 증명하지 않는다.",
      "[아직 모름] 발표문과 사진만으로 개별 민간인의 경험, 모든 행위자의 동기, 전체 피해 규모를 확정할 수 없다."
    ],
    "thinking_question": "각 자료에서 직접 확인할 수 있는 사실과 작성자가 독자를 설득하려고 내세운 주장을 어떻게 나눌 수 있을까? 민간인의 경험을 더 이해하려면 어떤 자료가 필요할까?",
    "choices": [
      "각 자료에서 날짜·작성 주체·확인 가능한 행동·가치 판단 표현을 색깔별로 나눈다.",
      "트루먼 발표와 프라우다 논평이 다르게 말한 부분과 두 문서 모두 빠뜨린 정보를 적는다.",
      "공식 발표문과 전쟁기 사진 중 하나만 보았을 때 생길 수 있는 오해를 적는다."
    ],
    "custom_input_allowed": true
  },
  "teacher_view": {
    "evidence_rationale": "VER-001은 유엔 공식 목록·메타데이터의 채택일과 문서 기호만 확인하고, VER-002~VER-004는 열어 본 자료의 날짜·명시적 내용을 확인한다. DER-001과 DER-002는 서로 다른 자료 유형을 비교해 도출한 제한적 해석이며, 자료 속 정치적 주장을 사실로 승격하지 않는다.",
    "misconception_watch": "공식 문서의 모든 문장을 중립적 사실로 보거나, 서로 반대되는 두 주장 사이의 중간값을 자동으로 정답으로 고르거나, 사진 한 장을 전체 민간 경험의 대표로 보는지 확인한다.",
    "assessment_note": "학생이 최소 두 자료에 대해 작성 주체와 직접 지지 범위를 말하고, 추가로 필요한 민간 자료를 한 가지 제안하는지 관찰한다."
  },
  "evidence_ids": [
    "VER-001",
    "VER-002",
    "VER-003",
    "VER-004",
    "DER-001",
    "DER-002",
    "UNK-001"
  ],
  "memory_delta": {
    "base_revision": 0,
    "next_revision": 1,
    "add": [
      {
        "path": "/memory/episode_archive/-",
        "value": {
          "id": "EP-001",
          "turn": 1,
          "student_choice": "[시작] 토큰으로 사료 비교 수업 시작",
          "result": "네 자료 카드와 세 가지 비폭력 자료 분석 선택지가 제시되었다.",
          "evidence_ids": [
            "VER-001",
            "VER-002",
            "VER-003",
            "VER-004",
            "DER-001",
            "DER-002"
          ],
          "must_keep": true
        },
        "reason": "첫 자료 비교 상태와 안전 경계를 시간 순서에 보존한다."
      }
    ],
    "correct": [],
    "resolve": []
  }
}
