{
  "turn": 1,
  "student_view": {
    "scene": "2026년 8월 15일, 학교 모의 연구윤리 공청회 준비실입니다. 당신은 고2 학생 검토위원입니다. 1932~1972년 연구 연표, 1973년 조사보고서, 1974년 국가연구법, 1979년 벨몬트 보고서, 현행 45 CFR 46이 놓여 있습니다. 진행자는 600명이 399명과 201명으로 나뉜 집계표만 보고 공정성을 판단해 달라고 합니다. 그러나 이 표는 집단 크기만 보여 줄 뿐, 참여자의 이해·자발성이나 위험과 편익의 분배를 말해 주지 않습니다. 각 자료가 답할 수 있는 범위를 구분해 검토 기준을 만드세요.",
    "clues": [
      "[확인됨] CDC 연표와 1973년 보고서는 600명의 구성과 충분한 설명에 근거한 동의가 없었다고 기록합니다. VER-001",
      "[확인됨] 벨몬트 원칙과 현행 규정은 동의, 위험 최소화, 공정한 선정을 따로 검토합니다. VER-004~VER-006",
      "[제한적 추론] 집계만으로 개인의 이해·자발성·부담의 공정성을 판정할 수 없습니다. DER-001",
      "[아직 모름] 이 사건이 현행 규정 각 조항에 기여한 정도는 단일 원인으로 확정할 수 없습니다. UNK-002",
      "[수업 설정] 학생은 실제 IRB가 아닌 학생 검토위원입니다. SCN-001, SCN-002"
    ],
    "thinking_question": "동의·위험·공정성을 따로 심사하는 첫 질문을 쓰고, 근거가 된 원문도 밝혀 보세요.",
    "choices": [
      "동의: 목적·위험·대안을 이해하고 강압 없이 선택했는지 확인할 기록을 요구한다.",
      "공정성: 집단 선정 이유와 부담·예상 편익이 한쪽에 치우쳤는지 묻는다.",
      "자료 한계: 집계표의 표시 항목과 공백을 나누고 추가 자료 전에는 결론을 보류한다."
    ],
    "custom_input_allowed": true
  },
  "teacher_view": {
    "evidence_rationale": "역사 기록 VER-001·VER-002, 법·윤리 원문 VER-003~VER-006, 제한 추론 DER-001·DER-002를 시간축별로 분리한다. 고급 모드는 공개 집계자료와 정책 분석을 심화하지만 P0 실행 정보는 늘리지 않는다.",
    "misconception_watch": "집계 수치가 동의나 공정성을 직접 측정한다고 보거나, 벨몬트 보고서와 현행 규정을 같은 종류·같은 시점의 문서로 합치거나, 터스키기 연구를 모든 현행 조항의 단일 원인으로 단정하는지 본다.",
    "assessment_note": "학생이 첫 검토 질문에 근거 ID, 적용 시점, 자료가 답하지 못하는 범위, 결론 확실성을 함께 표시하는지 관찰한다."
  },
  "evidence_ids": [
    "VER-001",
    "VER-002",
    "VER-003",
    "VER-004",
    "VER-005",
    "VER-006",
    "DER-001",
    "DER-002",
    "SCN-001",
    "SCN-002",
    "UNK-002"
  ],
  "memory_delta": {
    "base_revision": 0,
    "next_revision": 1,
    "add": [
      {
        "path": "/memory/episode_archive/-",
        "value": {
          "id": "EP-001",
          "turn": 1,
          "student_choice": "[시작] 토큰으로 모의 공청회 수업 시작",
          "result": "시점이 다른 다섯 자료 묶음과 동의·공정성·자료 한계 중심의 세 선택지가 제시됐다.",
          "evidence_ids": [
            "VER-001",
            "VER-004",
            "VER-005",
            "VER-006",
            "DER-001",
            "UNK-002",
            "SCN-001"
          ],
          "must_keep": true
        },
        "reason": "시작 게이트 소비와 첫 정책 검토 상태를 시간 순서대로 보존한다."
      }
    ],
    "correct": [],
    "resolve": []
  }
}
