{
  "turn": 1,
  "student_view": {
    "scene": "1945년 8월 10일, 일제 강점기의 경성에서 평범한 조선인 A는 서로 다른 전쟁 소문을 듣는다. A에게 미래 지식이나 특별한 능력은 없다.",
    "clues": [
      "[실제 역사에서 확인] 포츠담 선언은 1945년 7월 26일 일본에 항복을 요구했다.",
      "[수업 가정] 미국의 핵무기 개발은 실패했고 원자폭탄 투하는 없었다.",
      "[수업 가정] 최소 변경 원칙에 따라 소련의 대일전 참전은 일어났다.",
      "[아직 모름] 일본의 항복 날짜와 조건은 정해지지 않았다."
    ],
    "thinking_question": "원자폭탄이 없다는 사실 하나만으로 전쟁이 끝나는 날짜를 알 수 있을까? 어떤 다른 정보가 필요할까?",
    "choices": [
      "들은 말을 날짜, 말한 사람, 직접 본 증거로 나누어 적는다.",
      "가족과 사흘 동안 필요한 식량과 안전한 연락 방법을 점검한다.",
      "신뢰하는 어른에게 포츠담 선언과 소련 참전 소식을 각각 어떻게 알았는지 묻는다."
    ],
    "custom_input_allowed": true
  },
  "teacher_view": {
    "evidence_rationale": "VER-002와 실제 역사 자료를 제시하되 분기 이후는 SCENARIO와 UNKNOWN으로 분리한다.",
    "misconception_watch": "원자폭탄 하나만으로 광복과 항복의 모든 원인을 설명하거나, 원자폭탄이 없으면 일본이 절대 항복하지 않는다고 단정하는지 본다.",
    "assessment_note": "학생이 필요한 추가 정보를 한 가지 이상 제안하는지 관찰한다."
  },
  "evidence_ids": ["VER-002", "SCN-001", "SCN-002", "UNK-001", "DER-001"],
  "memory_delta": {
    "base_revision": 0,
    "next_revision": 1,
    "add": [
      {
        "path": "/memory/episode_archive/-",
        "value": {
          "id": "EP-001",
          "turn": 1,
          "student_choice": "[시작] 토큰으로 수업 시작",
          "result": "첫 장면과 세 가지 안전한 선택지가 제시되었다.",
          "evidence_ids": ["VER-002", "SCN-001", "SCN-002", "UNK-001"],
          "must_keep": true
        },
        "reason": "수업 시작과 첫 상태를 시간 순서에 보존한다."
      }
    ],
    "correct": [],
    "resolve": []
  }
}
