{
  "turn": 1,
  "student_view": {
    "scene": "가상의 해솔구 주민참여예산 모의회의에서 중학교 2학년 청소년 위원은 추가 예산 1억 원과 세 후보 사업을 받는다. 금액 합계는 맞지만 비용 산출서와 지역 수요 자료는 아직 없다.",
    "clues": [
      "[실제 법령에서 확인] 지방자치단체는 합리적인 기준에 따라 경비를 산정하고 예산 항목을 구체적으로 명시해야 한다.",
      "[실제 법령에서 확인] 지방자치단체는 주민이 예산과정에 참여할 수 있는 제도를 마련해 시행해야 한다.",
      "[수업 가정] 해솔구의 추가 예산 1억 원과 세 후보 사업·금액은 수업을 위해 만든 자료다.",
      "[아직 모름] 각 사업의 실제 비용, 이용자 수, 유지비와 예상 효과는 확인되지 않았다."
    ],
    "thinking_question": "세 후보의 금액 합계가 정확히 1억 원이라는 사실만으로 좋은 예산안이라고 판단할 수 있을까? 결론 전에 어떤 자료가 필요할까?",
    "choices": [
      "세 사업의 비용 산출 근거와 다음 해 유지비가 있는지 요청한다.",
      "연령·장애·이용시간에 따라 누가 혜택을 받고 누가 빠지는지 표로 만든다.",
      "현재 시설 상태, 실제 이용자 수와 주민 의견을 확인할 조사 계획을 세운다."
    ],
    "custom_input_allowed": true
  },
  "teacher_view": {
    "evidence_rationale": "법령이 정한 합리적 산정·주민 참여 원칙은 확인된 사실로, 해솔구와 후보 사업비는 수업 가정으로, 실제 수요와 효과는 아직 모름으로 분리한다.",
    "misconception_watch": "학생이 주민참여를 곧바로 결정권으로 해석하거나 전국 통계를 해솔구 수요로 바꾸어 말하는지 본다.",
    "assessment_note": "학생이 예산 총액 외에 비용 근거, 수혜 범위, 유지비, 현황 자료 중 두 가지 이상을 요구하는지 관찰한다."
  },
  "evidence_ids": ["VER-001", "VER-002", "SCN-001", "SCN-002", "UNK-001", "UNK-002", "DER-001"],
  "memory_delta": {
    "base_revision": 0,
    "next_revision": 1,
    "add": [
      {
        "path": "/memory/episode_archive/-",
        "value": {
          "id": "EP-001",
          "turn": 1,
          "student_choice": "[시작] 토큰으로 수업 시작",
          "result": "가상의 추가 예산안과 세 가지 안전한 조사 선택지가 제시되었다.",
          "evidence_ids": ["VER-001", "VER-002", "SCN-001", "UNK-001"],
          "must_keep": true
        },
        "reason": "수업 시작과 첫 예산 검토 상태를 시간 순서에 보존한다."
      }
    ],
    "correct": [],
    "resolve": []
  }
}
