{
  "turn": 1,
  "student_view": {
    "scene": "현재 수업 시간의 모의 연구윤리 검토 회의다. 학생 연구윤리위원은 아직 실행되지 않은 학교 설문 계획에서 강요 가능성, 불필요한 개인정보, 결과 왜곡, 무단 문항 사용 문제를 발견한다.",
    "clues": [
      "[공식 규정에서 확인] 인간대상연구는 시작 전에 연구계획서와 심의 절차를 확인해야 한다.",
      "[공식 규정에서 확인] 동의에는 목적, 절차, 위험과 이득, 개인정보 보호, 철회에 관한 설명과 자발성이 필요하다.",
      "[공식 규정에서 확인] 미성년 연구대상자에게는 추가 보호가 필요할 수 있고 실제 요건은 담당 기관이 판단한다.",
      "[공식 규정에서 확인] 개인정보는 목적에 필요한 최소 범위로 수집하고 안전하게 관리해야 한다.",
      "[공식 연구윤리 자료에서 확인] 위조·변조·표절·부당한 저자 표시는 예방해야 한다.",
      "[수업 가정] 실제 참여자 모집과 자료 수집은 아직 없으며 계획서는 수업용이다.",
      "[아직 모름] 이 학교 활동에 필요한 실제 심의·동의 절차는 교사와 담당 기관 확인 전에는 확정할 수 없다."
    ],
    "thinking_question": "이 계획의 문제를 동의, 위험, 개인정보, 연구진실성으로 나누면 무엇이며, 연구 시작 전에 어떤 수정이 필요한가?",
    "choices": [
      "참여자 모집을 보류하고 네 항목별 수정 필요 점검표를 만든다.",
      "불필요한 식별정보와 평가상 불이익 암시를 제거하고 자발적 참여·철회·문의 절차를 다시 쓴다.",
      "설문 문항의 원출처와 이용 조건을 확인하고 분석 전에 제외 기준과 원자료 보존 원칙을 문서화한다."
    ],
    "custom_input_allowed": true
  },
  "teacher_view": {
    "evidence_rationale": "법령, 대학 IRB 안내, 공식 연구윤리 자료를 교차 사용하되 실제 학교 활동의 법적 분류와 심의 면제 여부는 UNKNOWN으로 남긴다.",
    "misconception_watch": "보호자 동의만 있으면 학생 본인의 의사와 위험 검토가 불필요하다고 생각하거나, 이름을 지우기만 하면 개인정보 위험이 모두 사라진다고 단정하는지 본다.",
    "assessment_note": "학생이 네 영역의 문제를 각각 한 가지 이상 찾고, 실행이 아닌 사전 수정·확인 행동을 제안하는지 관찰한다."
  },
  "evidence_ids": ["VER-001", "VER-002", "VER-003", "VER-004", "VER-005", "SCN-001", "SCN-002", "UNK-001", "UNK-002", "DER-001"],
  "memory_delta": {
    "base_revision": 0,
    "next_revision": 1,
    "add": [
      {
        "path": "/memory/episode_archive/-",
        "value": {
          "id": "EP-001",
          "turn": 1,
          "student_choice": "[시작] 토큰으로 수업 시작",
          "result": "실행 전 가상 설문 계획에서 네 연구윤리 영역을 검토하는 첫 장면과 세 가지 안전한 선택지가 제시되었다.",
          "evidence_ids": ["VER-001", "VER-002", "VER-003", "VER-004", "VER-005", "SCN-001", "UNK-001"],
          "must_keep": true
        },
        "reason": "실제 모집·수집이 없다는 안전 경계와 첫 검토 상태를 보존한다."
      }
    ],
    "correct": [],
    "resolve": []
  }
}
